actor,films,film_votes,votes_per_film,directors,films
Michèle Morgan,2,7,3.50,"Marcel Carné, Carol Reed",Port of Shadows • The Fallen Idol
Ulrich Mühe,2,7,3.50,"Michael Haneke, Florian Henckel von Donnersmarck",Funny Games • The Lives of Others
Peter Van Eyck,2,7,3.50,"Henri-Georges Clouzot, Fritz Lang",The Wages of Fear • The Thousand Eyes of Dr Mabuse
Bob Dylan,2,6,3.00,"D.A. Pennebaker, Bob Dylan/D.A. Pennebaker",Don't Look Back • Eat the Document
Chen Shiang-chyi,2,6,3.00,"Tsai Ming Liang, Tsai Ming-Liang","Goodbye, Dragon Inn • The Wayward Cloud"
Chojuro Kawarazaki,2,6,3.00,"Mizoguchi Kenji, Yamanaka Sadao",The 47 Ronin • Humanity and paper balloons
Elliott Gould,2,6,3.00,"Robert Altman, Paul Mazursky",The Long Goodbye • Bob & Carol & Ted & Alice
Hiram Keller,2,6,3.00,"Federico Fellini, Catherine Breillat",Satyricon • A Real Young Lady
James Coburn,2,6,3.00,"Sam Peckinpah, Sergio Leone",Pat Garrett & Billy the Kid • Duck You Sucker
Jim Carrey,2,6,3.00,"Michel Gondry, Peter Weir",Eternal Sunshine of the Spotless Mind • The Truman Show
John Gielgud,2,6,3.00,"Alain Resnais, Tony Richardson",Providence • Charge of the Light Brigade
Julie Andrews,2,6,3.00,"Robert Wise, Robert Stevenson",The Sound of Music • Mary Poppins
Maude George,2,6,3.00,Erich von Stroheim,The Wedding March • Foolish Wives
Milena Dravic,2,6,3.00,"Dusan Makavejev, Matjaz Klopcic","WR: Mysteries of the Organism • Funeral Fest, Burial Lunch"
Ninetto Davoli,2,6,3.00,Pier Paolo Pasolini,Arabian Nights • Hawks and Sparrows
Rita Macedo,2,6,3.00,Luis Buñuel,Nazarín • The Criminal Life of Archibaldo de la Cruz
Susan Hayward,2,6,3.00,"Nicholas Ray, Jacques Tourneur",The Lusty Men • Canyon Passage
Walter Huston,2,6,3.00,"John Huston, Frank Capra",The Treasure of Sierra Madre • American Madness
Howard Da Silva,2,6,3.00,"Nicholas Ray, Frank Perry",They Live By Night • David and Lisa
Maurício do Valle,2,6,3.00,Glauber Rocha,The Age of the Earth • Antonio das Mortes
The Rolling Stones,2,6,3.00,"Albert Maysles/David Maysles/Charlotte Zwerin, Robert Frank",Gimme Shelter • Cocksucker Blues
Haji,2,5,2.50,"Russ Meyer, Fukasaku Kinji","Faster, Pussycat! Kill! Kill! • Jingi no hakaba"
Adriana Asti,2,5,2.50,"Luis Buñuel, Marco Tullio Giordana",The Phantom of Liberty • The Best of Youth
Alberto Sordi,2,5,2.50,"Federico Fellini, Dino Risi",I Vitelloni • A Difficult Life
Anjelica Huston,2,5,2.50,"John Huston, Wes Anderson",The Dead • The Royal Tenenbaums
Ann Savage,2,5,2.50,"Edgar G. Ulmer, Guy Maddin","Detour • Winnipeg, My"
Atila Iorio,2,5,2.50,"Nelson Pereira dos Santos, Ruy Guerra",Barren Lives • The Guns
Billy Zane,2,5,2.50,"Sally Potter, James Cameron",Orlando • Titanic
Carl Lee,2,5,2.50,"Shirley Clarke, Gordon Parks Jr",Portrait of Jason • Superfly
Charles Farrell,2,5,2.50,"Frank Borzage, FW Murnau",7th Heaven • City Girl
Claire Bloom,2,5,2.50,"Charles Chaplin, George Cukor",Limelight • The Chapman Report
Colin Clive,2,5,2.50,James Whale,Bride of Frankenstein • Frankenstein
Constance Towers,2,5,2.50,Samuel Fuller,Shock Corridor • The Naked Kiss
Farid Shawki,2,5,2.50,"Youssef Chahine, Salah Abu Seif",Cairo Station • The Water Carrier has Died
Franco Fabrizi,2,5,2.50,"Federico Fellini, Dino Risi",I Vitelloni • A Difficult Life
Franco Interlenghi,2,5,2.50,"Federico Fellini, Vittorio De Sica",I Vitelloni • Shoeshine
Helmut Berger,2,5,2.50,Luchino Visconti,Ludwig • Conversation Piece
Jack Carson,2,5,2.50,"George Cukor, Michael Curtiz",A Star is Born • Mildred Pierce
Janice Rule,2,5,2.50,"Frank Perry, Robert Altman",The Swimmer • Three Women
Javier Bardem,2,5,2.50,"Joel & Ethan Coen, Alejandro González Iñárritu",No Country for Old Men • Biutiful
Josh Brolin,2,5,2.50,"Joel & Ethan Coen, Richard Donner",No Country for Old Men • The Goonies
Karen Allen,2,5,2.50,"Steven Spielberg, Philip Kaufman",Raiders of the Lost Ark • The Wanderers
Magdalena Montezuma,2,5,2.50,Werner Schroeter,The Death of Maria Malibran • The Rose King
Margaret Leighton,2,5,2.50,"John Ford, Joseph Losey",Seven Women • The Go-Between
Mark Ruffalo,2,5,2.50,"David Fincher, Lisa Cholodenko",Zodiac • The Kids Are All Right
Michelle Williams,2,5,2.50,"Charlie Kaufman, Kelly Reichardt","Synecdoche, New York • Wendy and Lucy"
Milla Jovovich,2,5,2.50,"Richard Linklater, Luc Besson",Dazed and Confused • The Messenger: the Story of Joan of Arc
Muzzafer Özdemir,2,5,2.50,Nuri Bilge Ceylan,Uzak/Distant • Clouds of May
Nicolas Cage,2,5,2.50,"Joel & Ethan Coen, David Lynch",Raising Arizona • Wild at Heart
Rex Harrison,2,5,2.50,"Joseph L. Mankiewicz, Sidney Gilliat",The Ghost and Mrs Muir • The Rake's Progress
River Phoenix,2,5,2.50,"Gus van Sant, Rob Reiner",My Own Private Idaho • Stand by Me
Robert Walker,2,5,2.50,"Alfred Hitchcock, Vincente Minnelli",Strangers on a Train • The Clock
Ronald Colman,2,5,2.50,"Mervyn LeRoy, Ernst Lubitsch",Random Harvest • Lady Windermere's Fan
Sami Frey,2,5,2.50,"Jean-Luc Godard, Dusan Makavejev",Bande à part • Sweet Movie
Simone Simon,2,5,2.50,"Jean Renoir, Jacques Tourneur",La Bête Humaine • Cat People
Steven Bauer,2,5,2.50,Brian De Palma,Scarface • Raising Cain
Sue Lyon,2,5,2.50,"John Ford, Stanley Kubrick",Seven Women • Lolita
Vladimir Popov,2,5,2.50,"Albert Lamorisse, Marlen Khutsiyev",The Red Balloon • I am Twenty
Zhang Ziyi,2,5,2.50,"Ang Lee, Zhang Yimou","Crouching Tiger, Hidden Dragon • House of Flying Daggers"
Billy Bob Thornton,2,5,2.50,"Miyazaki Hayao, Marc Forster",Princess Mononoke • Monster's Ball
Robert Downey Jr,2,5,2.50,"David Fincher, Oliver Stone",Zodiac • Natural Born Killers
Sacha Baron Cohen,2,5,2.50,"Martin Scorsese, Larry Charles",Hugo • Borat
Divine,2,4,2.00,John Waters,Female Trouble • Pink Flamingos
Rufus,2,4,2.00,"Jean-Pierre Jeunet, Alain Tanner",Amelie • Jonah Who Will Be 25 in the Year 2000
Séverin-Mars,2,4,2.00,Abel Gance,"La Roue • accuse, J'"
Zouzou,2,4,2.00,"Shadi Abdel Salam, Eric Rohmer",The Night of Counting the Years • Love in the Afternoon
André Wilms,2,4,2.00,Aki Kaurismaki,Le Havre • The Bohemian Life
Angela Winkler,2,4,2.00,"Volker Schlöndorff, Peter Handke",The Tin Drum • The Left-Handed Woman
Angeli Bayani,2,4,2.00,Lav Díaz,Melancolia • Death of the Land of Encantos
Angie Dickinson,2,4,2.00,"John Boorman, Roger Vadim",Point Blank • Pretty Maids All in a Row
Barbara Sukowa,2,4,2.00,"Lars von Trier, Margarethe von Trotta",Europa • The German Sisters
Boris Karloff,2,4,2.00,James Whale,Bride of Frankenstein • The Old Dark House
Bruno Cremer,2,4,2.00,"William Friedkin, Jean-Claude Brisseau",Sorcerer • Sound and Fury
Charles Winninger,2,4,2.00,"John Ford, William A Wellman",The Sun Shines Bright • Nothing Sacred
Coleen Gray,2,4,2.00,"Stanley Kubrick, Edmund Goulding",The Killing • Nightmare Alley
Dan Dailey,2,4,2.00,"John Ford, Stanley Donen/Gene Kelly",The Wings of Eagles • It's Always Fair Weather
Danièle Huillet,2,4,2.00,Jean-Marie Straub/Danièle Huillet,"Too Early, Too Late • Einleitung zu Arnold Schönbergs “Begleitmusik zu einer Lichtspielscene/Introduction to Arnold Schoenberg's Accompaniment to a Cinematic Scene"
David Lochary,2,4,2.00,John Waters,Female Trouble • Pink Flamingos
Elizabeth Taylor,2,4,2.00,"George Stevens, Mike Nichols",A Place in the Sun • Who's Afraid of Virginia Wolf?
Ewen Bremner,2,4,2.00,"Danny Boyle, Harmony Korine",Trainspotting • Julien Donkey Boy
Gabriel Byrne,2,4,2.00,"Joel & Ethan Coen, Bryan Singer",Miller's Crossing • The Usual Suspects
Hélène Diarra,2,4,2.00,"Abderrahmane Sissako, Ousmane Sembene",Bamako • Moolaadé
Horst Buchholz,2,4,2.00,"Billy Wilder, J Lee Thompson","One, Two, Three • Tiger Bay"
Jack Smith,2,4,2.00,Ken Jacobs,Little Stabs at Happiness • Star Spangled to Death
James Cagney,2,4,2.00,"Billy Wilder, Raoul Walsh","One, Two, Three • White Heat"
Jane Fonda,2,4,2.00,"Jean-Luc Godard/Jean-Pierre Gorin, George Cukor",Tout va Bien • The Chapman Report
Jece Valadão,2,4,2.00,"Glauber Rocha, Nelson Pereira dos Santos",The Age of the Earth • Rio 40 Graus
Jitsuko Yoshimura,2,4,2.00,"Imamura Shohei, Shindo Kaneto",The Insect Woman • Onibaba
John Cleese,2,4,2.00,"Terry Jones, Terry Gilliam",Monty Python's Life of Brian • Time Bandits
John Gilbert,2,4,2.00,"King Vidor, Erich von Stroheim",The Big Parade • The Merry Widow
Konstantin Lavronenko,2,4,2.00,Andrei Zvyagintsev,The Return • The Banishment
Laurence Harvey,2,4,2.00,"John Frankenheimer, Jack Clayton",The Manchurian Candidate • Room At The Top
Lee Miller,2,4,2.00,"Danny Boyle, Jean Cocteau",Trainspotting • The Blood of a Poet
Liam Cunningham,2,4,2.00,"Steve McQueen, Ken Loach",Hunger • The Wind that Shakes the Barley
Lothaire Bluteau,2,4,2.00,"Sally Potter, Denys Arcand",Orlando • Jesus of Montreal
Michelle Pfeiffer,2,4,2.00,"Brian De Palma, Martin Scorsese",Scarface • The Age of Innocence
Monica Bellucci,2,4,2.00,"Gaspar Noé, Mel Gibson",Irreversible • The Passion of Christ
Perry Dizon,2,4,2.00,Lav Díaz,Melancolia • Death of the Land of Encantos
Pierre Renoir,2,4,2.00,Jean Renoir,La nuit du carrefour • La Marseillaise
Piper Laurie,2,4,2.00,"Brian de Palma, Robert Rossen",Carrie • The Hustler
Rade Serbedzija,2,4,2.00,"Milcho Manchevski, Matjaz Klopcic","Before the Rain • Funeral Fest, Burial Lunch"
Roeder Camanag,2,4,2.00,Lav Díaz,Melancolia • Death of the Land of Encantos
Russell Crowe,2,4,2.00,"Michael Mann, Ridley Scott",The Insider • Gladiator
Ruth Roman,2,4,2.00,"Alfred Hitchcock, Nicholas Ray",Strangers on a Train • Bitter Victory
Sonia Saviange,2,4,2.00,"Paul Vecchiali, Jean-Claude Biette","Femmes, Femmes • Le Théâtre des matières"
Sumiko Sakamoto,2,4,2.00,Imamura Shohei,The Ballad of Narayama • The Pornographers
Tarik Akan,2,4,2.00,"Serif Gören/Yilmaz Güney, Yilmaz Güney",Yol • The Herd
Teresa Wright,2,4,2.00,"Alfred Hitchcock, Raoul Walsh",Shadow of A Doubt • Pursued
Theresa Russell,2,4,2.00,"Nicolas Roeg, Ernie Gehr",Bad Timing • Eureka
Tom Conway,2,4,2.00,Jacques Tourneur,Cat People • I Walked With a Zombie
Yoshiko Kuga,2,4,2.00,"Ozu Yasujirô, Mizoguchi Kenji",Good Morning • Tales of the Taira Clan
Ana Maria Magalhães,2,4,2.00,"Glauber Rocha, Nelson Pereira dos Santos",The Age of the Earth • How Tasty Was My Little Frenchman
Jet Li Lianjie,2,4,2.00,"Zhang Yimou, Tsui Hark",Hero • Once Upon a Time in China (II)
Klaus Maria Brandauer,2,4,2.00,"Istvan Szabo, Sydney Pollack",Mephisto • Out of Africa
Mary Vivian Pearce,2,4,2.00,John Waters,Female Trouble • Pink Flamingos
Pilar López de Ayala,2,4,2.00,"José Luis Guerín, Manoel de Oliveira",In the City of Sylvia • The Strange Case of Angelica
Miou-Miou,2,3,1.50,"Bertrand Blier, Alain Tanner",Going Places • Jonah Who Will Be 25 in the Year 2000
Adriano Aprà,2,3,1.50,Jean-Marie Straub/Danièle Huillet,Othon • Fortini/Cani
Alan Rickman,2,3,1.50,"Tim Burton, John McTiernan",Sweeney Todd • Die Hard
Alex Descas,2,3,1.50,"Claire Denis, Raoul Peck",35 Shots of Rum • Lumumba
Anna Ciepielewska,2,3,1.50,"Jerzy Kawalerowicz, Andrzej Munk/Witold Lesiewicz",Mother Joan of the Angels • Pasazerka
Annette Bening,2,3,1.50,"Sam Mendes, Lisa Cholodenko",American Beauty • The Kids Are All Right
Arnold Schwarzenegger,2,3,1.50,James Cameron,The Terminator • Terminator II: Judgement Day
Ashok Kumar,2,3,1.50,Kamal Amrohi,Pakeezah • Mahal
Birger Malmsten,2,3,1.50,Ingmar Bergman,Prison • Summer Interlude
Brad Dourif,2,3,1.50,"John Huston, Tobe Hooper",Wise Blood • Spontaneous Combustion
Carl Esmond,2,3,1.50,"Max Ophüls, Fritz Lang",Liebelei • Ministry of Fear
Carol Dempster,2,3,1.50,D.W. Griffith,Isn't Life Wonderful • Dream Street
Carroll Baker,2,3,1.50,"John Ford, William Wyler",Cheyenne Autumn • The Big Country
Cecil Parker,2,3,1.50,Alexander Mackendrick,The Ladykillers • Man in the White Suit
Chris Sarandon,2,3,1.50,"Henry Selick, Rob Reiner",The Nightmare Before Christmas • The Princess Bride
Colin Farrell,2,3,1.50,"Terrence Malick, Martin McDonagh",The New World • In Bruges
Dennis Haysbert,2,3,1.50,"Todd Haynes, Scott McGehee/David Siegel",Far From Heaven • Suture
Don Cheadle,2,3,1.50,"Paul Thomas Anderson, Paul Haggis",Boogie Nights • Crash
Dorothy Malone,2,3,1.50,"Raoul Walsh, Douglas Sirk",Colorado Territory • The Tarnished Angels
Edie Sedgwick,2,3,1.50,Andy Warhol,Outer and Inner Space • Beauty No 2
Fabrice Luchini,2,3,1.50,Eric Rohmer,Full Moon in Paris • Perceval
Fan Wei,2,3,1.50,"Sun Yu, Lu Chuan",The Road • City of Life and Death
Frances Dee,2,3,1.50,"Jacques Tourneur, Rouben Mamoulian",I Walked With a Zombie • Becky Sharp
François Negret,2,3,1.50,"Jean-Claude Brisseau, Chantal Akerman",Sound and Fury • Nuit et jour
Gabrielle Dorziat,2,3,1.50,"Jacques Becker, Vittorio Cottafavi",Falbalas/Paris Frills • Traviata '53
George Peppard,2,3,1.50,"Blake Edwards, Vincente Minnelli",Breakfast at Tiffany's • Home from the Hill
Geraldine Chaplin,2,3,1.50,"David Lean, Carlos Saura",Doctor Zhivago • Anna and the Wolves
Ginette Leclerc,2,3,1.50,"Henri-Georges Clouzot, Walerian Borowczyk","Le Corbeau • Goto, Island of Love"
Grazyna Szapolowska,2,3,1.50,Krzysztof Kieslowski,A Short Film About Love • No End
Hannelore Hoger,2,3,1.50,"Alf Brustellin, Rainer Werner
Fassbinder, Alexander Kluge, Maximiliane Mainka, Beate
Mainka-Jellinghaus, Peter Schubert, Bernhard Sinkel, Hans Peter Cloos,
Edgar Reitz, Katja Rupé, Volker Schlöndorff, Alexander Kluge",Germany in Autumn • Artists under the Big Top: Perplexed
Heather Angel,2,3,1.50,John Ford,The Informer • Pilgrimage
Hertha Thiele,2,3,1.50,"Bertold Brecht/Ernst Ottwald, Leontine Sagan/Carl Froelich",Kuhle Wampe • Mädchen in Uniform
Hughie Restorick,2,3,1.50,Bill Douglas,My Childhood • My Ain Folk
Isa Miranda,2,3,1.50,"Max Ophüls, Mario Soldati",La Signora di Tutti • Malombra
Jackie Chan,2,3,1.50,"Jackie Chan, Kar-leung Lau",Police Story • Drunken Master II
Jane Asher,2,3,1.50,"Jerzy Skolimowski, Roger Corman",Deep End • Masque of Red Death
Janet Margolin,2,3,1.50,"Woody Allen, Frank Perry",Take the Money and Run • David and Lisa
Jean Debucourt,2,3,1.50,"Jean Epstein, Jean Grémillon",The Fall of the House of Usher • The Woman Who Dared
Jean-Christophe Bouvet,2,3,1.50,"Jean-Claude Biette, Jean-Luc Godard",Le Théâtre des matières • Notre Music
Jennifer Jones,2,3,1.50,"Ernst Lubitsch, William Dieterle",Cluny Brown • Portrait of Jennie
Joan Cusack,2,3,1.50,"John Lasseter/Ash Brannon/Lee Unkrich, Lee Unkrich",Toy Story 2 • Toy Story 3
József Madaras,2,3,1.50,"Miklos Jancso, András Kovács",The Red and the White • The Stud Farm
Kei Sato,2,3,1.50,"Nagisa Oshima, Shindo Kaneto",Death by Hanging • Onibaba
Kevin Costner,2,3,1.50,"Clint Eastwood, Ron Shelton",A Perfect World • Bull Durham
Lance Henriksen,2,3,1.50,"Jim Jarmusch, Kathryn Bigelow",Dead Man • Near Dark
Linda Hamilton,2,3,1.50,James Cameron,The Terminator • Terminator II: Judgement Day
Lucyna Winnicka,2,3,1.50,Jerzy Kawalerowicz,Mother Joan of the Angels • Night Train
Luis Guzmán,2,3,1.50,"Paul Thomas Anderson, Bette Gordon",Boogie Nights • Variety
Maribel Verdú,2,3,1.50,"Guillermo del Toro, Alfonso Cuarón",Pan's Labyrinth • Y tu mamá también
Marquard Böhm,2,3,1.50,"Rainer Werner Fassbinder, Roland Kick",Beware of a Holy Whore • Deadlock
Matthew Broderick,2,3,1.50,"John Hughes, Alexander Payne",Ferris Bueller's Day Off • Election
Michael Biehn,2,3,1.50,James Cameron,The Terminator • Aliens
Micheál Macliammóir,2,3,1.50,"Orson Welles, Tony Richardson",Othello • Tom Jones
Micheline Presle,2,3,1.50,"Jacques Becker, Jean Grémillon",Falbalas/Paris Frills • The Love of a Woman
Myriem Roussel,2,3,1.50,Jean-Luc Godard,"Prenom: Carmen • Je vous salue, Marie"
Nelson Villagra,2,3,1.50,"Raúl Ruiz, Tomás Gutiérrez Alea",Tres tristes tigres • The Last Supper
Pascale Ogier,2,3,1.50,"Eric Rohmer, Jacques Rivette",Full Moon in Paris • Le Pont du Nord
Patrick Bauchau,2,3,1.50,"Eric Rohmer, Jørgen Leth/Lars von Trier",La collectionneuse • The Five Obstructions
Patrick Dewaere,2,3,1.50,"Bertrand Blier, Andre Techine",Going Places • Hotel des Ameriques
Paul McCartney,2,3,1.50,"Richard Lester, William Klein",A Hard Day's Night • Muhammad Ali: The Greatest
Paul Robeson,2,3,1.50,"Leo T. Hurwitz, Kenneth MacPherson",Dialogue with a Woman Departed • Borderline
Paul Scofield,2,3,1.50,"Patrick Keiller, Fred Zinnemann",London • A Man For All Seasons
Peter Boyle,2,3,1.50,"Mel Brooks, Marc Forster",Young Frankenstein • Monster's Ball
Raghuvir Yadav,2,3,1.50,"Mira Nair, Anil Mehta",Salaam Bombay! • Aaja Nachle
Renée Carl,2,3,1.50,Louis Feuillade,Fantomas • L' aveugle de Jérusalem
Richard Widmark,2,3,1.50,"John Ford, Otto Preminger",Cheyenne Autumn • Saint Joan
Rod Steiger,2,3,1.50,"Sydney Lumet, Sergio Leone",The Pawnbroker • Duck You Sucker
Spencer Tracy,2,3,1.50,"Frank Borzage, Raoul Walsh",Man's Castle • Me and My Gal
Tom Courtenay,2,3,1.50,"David Lean, John Schlesinger",Doctor Zhivago • Billy Liar
Victor McLaglen,2,3,1.50,"John Ford, Josef von Sternberg",The Informer • Dishonored
Virginia Mayo,2,3,1.50,Raoul Walsh,Colorado Territory • White Heat
Vladimir Fogel,2,3,1.50,"Boris Barnet, Abram Room",The House of Trubnaia Square • Bed and Sofa
William Powell,2,3,1.50,"Gregory La Cava, Josef von Sternberg",My Man Godfrey • The Last Command
Yoshio Tsuchiya,2,3,1.50,"Toshio Matsumoto, Akira Kurosawa",Funeral Parade of Roses • Red Beard
Zbigniew Cybulski,2,3,1.50,Wojciech Has,How to be Loved • The Saragossa Manuscript
Gael García Bernal,2,3,1.50,"Alejandro González Iñárritu, Alfonso Cuarón",Amores Perros • Y tu mamá también
Jean Taylor Smith,2,3,1.50,Bill Douglas,My Childhood • My Ain Folk
Shah Rukh Khan,2,3,1.50,"Aditya Chopra, Mani Ratnam",Dilwale Dulhania Le Jayenge • Dil Se…
Trân Nû Yên Khê,2,3,1.50,"Tran Anh Hung, Anh Dung Tran",Cyclo • The Scent of Green Papaya
Annabella,2,2,1.00,"Abel Ferrara, Marcel Carné",The Addiction • Hotel Du Nord
Dharmendra,2,2,1.00,"Sriram Raghavan, Ramesh Sippy",Johnny Gaddaar • Sholay
Madhubala,2,2,1.00,"K. Asif, Kamal Amrohi",The Emperor of the Mughals • Mahal
Ahmed Benaïssa,2,2,1.00,"Tarek Teguia, Tariq Teguia",Gabbla • Rome Rather Than You
Alexandra Kluge,2,2,1.00,Alexander Kluge,Artists under the Big Top: Perplexed • Yesterday Girl
Alf Kjellin,2,2,1.00,"Alf Sjöberg, Ingmar Bergman",Iris and the Lieutenant • Summer Interlude
Alfred Filbert,2,2,1.00,"Robert Kramer, Thomas Harlan",Our Nazi • Wundkanal
Allen Ginsberg,2,2,1.00,"Andy Warhol, Jonas Mekas",Couch (series) • Guns of the Trees
Amitabh Bachchan,2,2,1.00,"Manmohan Desai, Ramesh Sippy",Amar Akbar Anthony • Sholay
André Morell,2,2,1.00,"Jay Lewis, John Gilling",The Baby and the Battleship • The Plague of the Zombies
Andrzej Seweryn,2,2,1.00,"Andrzej Zulawski, Andrzej Wajda",On The Silver Globe • Without Anesthesia
Ann Miller,2,2,1.00,"Brian De Palma, George Sydney",Carlito's Way • Kiss Me Kate
Anne Consigny,2,2,1.00,"Manoel de Oliveira, Alain Resnais",The Satin Slipper • Wild Grass
Anthony Wong,2,2,1.00,"Johnnie To, Andrew Lau/Alan Mak",Exiled • Infernal Affairs
Antonio Gades,2,2,1.00,Carlos Saura,Blood Wedding • Carmen
Asia Argento,2,2,1.00,"Asia Argento, Abel Ferrara",The Heart is Deceitful Above All Things • New Rose Hotel
Barbara Hershey,2,2,1.00,"Martin Scorsese, Philip Kaufman",The Last Temptation of Christ • The Right Stuff
Bela Lugosi,2,2,1.00,"Erle C Kenton, Victor Halperin",Island of Lost Souls • White Zombie
Benjamin Christensen,2,2,1.00,"Benjamin Christensen, Carl Theodor Dreyer",Haxan: Witchcraft Through the Ages • Michael
Bing Crosby,2,2,1.00,"Leo McCarey, Charles Walters",The Bells of St Mary's • High Society
Boris Barnet,2,2,1.00,"Lev Kuleshov, Boris Barnet",Extraordinary Adventures of Mr West in the Land of the Bolsheviks • Okraïna
Boris Eustache,2,2,1.00,Jean Eustache,Numéro zéro • Le Photos d'Alixs
Brian Donlevy,2,2,1.00,"Jacques Tourneur, Jerry Lewis",Canyon Passage • The Errand Boy
Buck Henry,2,2,1.00,"John Cassavetes, Milos Forman",Gloria • Taking Off
Burt Young,2,2,1.00,"John G Avildsen, Sylvester Stallone",Rocky • Rocky III
Carl Raddatz,2,2,1.00,"Veit Harlan, Helmut Kautner",The Great Sacrifice • Under the Bridges
Carrie Snodgress,2,2,1.00,"Brian de Palma, Clint Eastwood",The Fury • The Pale Rider
Casey Affleck,2,2,1.00,"Andrew Dominik, Gus van Sant",The Assasination of Jesse James by the Coward Robert Ford • Gerry
Christopher Reeve,2,2,1.00,"Jeannot Szwarc, Richard Donner",Somewhere In Time • Superman: The Movie
Claire Danes,2,2,1.00,"Francis Ford Coppola, Baz Luhrmann",The Rainmaker • William Shakespeare's Romeo+Juliet
Clive Owen,2,2,1.00,"Alfonso Cuarón, Mike Hodges",Children of Men • Croupier
Damouré Zika,2,2,1.00,Jean Rouch,Jaguar • Petit a petit
Daniel Gélin,2,2,1.00,"Jacques Becker, Louis Malle",Edouard et Caroline • Murmur of the Heart
Danny Glover,2,2,1.00,"Lars von Trier, Charles Burnett",Manderlay • To Sleep with Anger
Dawn Addams,2,2,1.00,"Charles Chaplin, Fritz Lang",A King In New York • The Thousand Eyes of Dr Mabuse
Dick Powell,2,2,1.00,"Vincente Minnelli, Busby Berkeley",The Bad and the Beautiful • Dames
Dinara Droukarova,2,2,1.00,"Vitali Kanevsky, Alexey Balabanov","Freeze, Die Come Alive • Of Freaks and Men"
Diogo Dória,2,2,1.00,Manoel de Oliveira,Francisca • Os Canibais
Doris Day,2,2,1.00,"George Abbott/Stanley Donen, Gordon Douglas",The Pajama Game • Young at Heart
Eden Kötting,2,2,1.00,"Andrew Kotting, Andrew Kötting",Gallivant • This Our Still Life
Edward Furlong,2,2,1.00,"James Gray, James Cameron",Little Odessa • Terminator II: Judgement Day
Ezra Miller,2,2,1.00,"Antonio Campos, Lynne Ramsay",Afterschool • We Need To Talk About Kevin
Ezzat el-Alaili,2,2,1.00,"Youssef Chahine, Salah Abu Seif",The Earth • The Water Carrier has Died
Fabio Testi,2,2,1.00,"Monte Hellman, Andrzej Zulawski",Iguana • The Most Important Thing: Love
Fernando Soler,2,2,1.00,Luis Buñuel,The Great Madcap • Susana
Freida Pinto,2,2,1.00,"Rupert Wyatt, Michael Winterbottom",Rise of the Planet of the Apes • Trishna
Frieda Richard,2,2,1.00,"FW Murnau, Lupu Pick",Phantom • Sylvester
Fumio Watanabe,2,2,1.00,"Oshima Nagisa, Nagisa Oshima",The Boy • Night and Fog in Japan
Gabriel Gabrio,2,2,1.00,"Marcel Pagnol, Julien Duviver",Harvest • Pepe Le Moko
Gary Merrill,2,2,1.00,"Anatole Litvak, Henry King",Decision Before Dawn • Twelve O'Clock High
Geoffrey Rush,2,2,1.00,"Tom Hooper, Gore Verbinski",The King's Speech • Pirates of the Caribbean III: At World's End
Gert Fröbe,2,2,1.00,"Guy Hamilton, Fritz Lang",Goldfinger • The Thousand Eyes of Dr Mabuse
Habibollah Safarian,2,2,1.00,"Sohrab Shahid-Saless, Sohrab Shahid Saless",A Simple Even • Still Life
Henri Poupon,2,2,1.00,Marcel Pagnol,Angèle • Merlusse
Hilda Borgström,2,2,1.00,Victor Sjöström,Ingeborg Holm • The Phantom Carriage
Ian Holm,2,2,1.00,"Woody Allen, Atom Egoyan",Another Woman • The Sweet Hereafter
Illo Gaoudel,2,2,1.00,Jean Rouch,Jaguar • Petit a petit
Irasema Dilián,2,2,1.00,"Mario Soldati, Luis Buñuel",Malombra • Wuthering Heights
Jack Taylor,2,2,1.00,"Pere Portabella, Jess Franco",Cuadecuc-Vampir • Succubus
James Cromwell,2,2,1.00,"Michel Hazanavicius, Chris Noonan",The Artist • Babe
Jean Simmons,2,2,1.00,"William Wyler, Joseph L. Mankiewicz",The Big Country • Guys and Dolls
Jean-Hugues Anglade,2,2,1.00,"Claude Sautet, Patrice Chereau",Nelly et Monsieur Arnaud • La Reine Margot
Joan Allen,2,2,1.00,"Ang Lee, Michael Mann",The Ice Storm • Manhunter
Joan Bennett,2,2,1.00,"Raoul Walsh, Max Ophüls",Me and My Gal • The Reckless Moment
Joan Chen,2,2,1.00,"Bernardo Bertolucci, Ang Lee",The Last Emperor • Lust Caution
Joanne Woodward,2,2,1.00,"Martin Scorsese, Paul Newman",The Age of Innocence • Rachel Rachel
Joe Dallesandro,2,2,1.00,"Louis Malle, Andy Warhol",Black Moon • Trash
John Barrymore,2,2,1.00,"Mitchell Leisen, John Akomfrah",Midnight • Nine Muses
John Getz,2,2,1.00,"Joel & Ethan Coen, David Cronenberg",Blood Simple • The Fly
Julie Hagerty,2,2,1.00,"Jim Abrahams/David & Jerry Zucker, Tom Noonan",Airplane! • The Wife
Kayo Matsuo,2,2,1.00,"Suzuki Seijun, Misumi Kenji",Gate of Flesh • Sakura No Daimon
Ken Watanabe,2,2,1.00,"Christopher Nolan, Clint Eastwood",Inception • Letters from Iwo Jima
Kenneth More,2,2,1.00,"Roy Ward Baker, Lewis Gilbert",A Night to Remember • Reach for the Sky
Lam Dia,2,2,1.00,Jean Rouch,Jaguar • Petit a petit
Lambert Wilson,2,2,1.00,"Raúl Ruiz, Xavier Beauvois",Love Torn in a Dream • Of Gods and Men
Lars Ulrich,2,2,1.00,"Sacha Gervasi, Joe Berlinger, Bruce Sinofsky",Anvil: The Story of Anvil • Metallica: Some Kind of Monster
Laurence Olivier,2,2,1.00,"Laurence Olivier, Alfred Hitchcock",Hamlet • Rebecca
Lena Olin,2,2,1.00,"Sidney Lumet, Philip Kaufman",Night Falls on Manhattan • The Unbearable Lightness of Being
Leo McKern,2,2,1.00,"Fred Zinnemann, Joseph Losey",A Man For All Seasons • Time Without Pity
Lilli Palmer,2,2,1.00,"Robert Rossen, Sidney Gilliat",Body and Soul • The Rake's Progress
Liu Ye,2,2,1.00,"Sijie Dai, Lu Chuan",Balzac and The Little Chinese Seamstress • City of Life and Death
Liv Tyler,2,2,1.00,"Martha Fiennes, Peter Jackson",Onegin • The The Lord of the Rings: Fellowship of the Ring (Theatrical version)
Luis Ciges,2,2,1.00,"José Luis Cuerda, Javier Fesser","Amanece, que no es poco • El Milagro de P. Tinto"
Madeleine Renaud,2,2,1.00,Jean Grémillon,Lumière d'été • The Woman Who Dared
